,ID,Created_at,Location,text,label
489299,86413,5/11/2011 20:45,42.29614 93.5046,This restaurant is freezing cold!!!,1
489300,86413,5/3/2011 20:45,42.21447 93.39197,Omg  I'm super cold and this blanket isn't working and mom is taking a shower so li can't use the hot water.ugh,1
489372,86425,5/3/2011 19:26,42.22272 93.3688,Ahhhh bed time is slowly approaching :(,1
489535,86448,5/6/2011 13:15,42.2127 93.37399,I eat NOW!!!! My headache is kiiiiiling me ~_____~ bon apetit yeorobun!!,1
489634,86466,5/12/2011 4:43,42.23569 93.34843,#dontyoujusthateitwhen a person has stank breath & chapped lips??? Bad combo,1
489711,86480,5/10/2011 9:53,42.20592 93.35083,breathe carolinas new video is just...mmm perfect :] &lt;33,1
489740,86482,5/16/2011 11:35,42.23157 93.30609,Slept through GH my insomnia has been messing with me... Getting ready to watch it now...,1
489880,86500,5/15/2011 22:19,42.25044 93.32207,The amt of dishes namely espresso & tea cups  is staggering. (Deep breath) Time for risotto & wine.,1
490455,86585,5/1/2011 17:28,42.27314 93.41633,#dontyoujusthateitwhen someone sick invites theirself over  coughing and sneezing all over  and cant take a hint to leave,1
490458,86585,5/11/2011 20:57,42.241 93.33885,how to find the perfect man: set your house on fire  call the fire brigade and lay in the garden half dressed and coughing.,1
490498,86589,5/10/2011 11:17,42.22832 93.37519,Baseball season turns an otherwise pleasant neighborhood into a cesspool of orange-wearing litterers  vomiters  scalpers  and loud assho,1
490499,86589,5/11/2011 11:17,42.24159 93.34604,And of course I flub it with an apostrophe.,1
490573,86596,4/30/2011 21:04,42.27579 93.37919,Why am I like this? Why is winter cold?,1
490695,86612,4/30/2011 0:15,42.22243 93.34244,Another Saturday morning  woke up to nasty headache. Looks like today's run is being rescheduled to pre-swim tomorrow :-(,1
490760,86624,5/8/2011 5:07,42.21682 93.22701,Yawn I want to go back to sleep  interwebs is cold dark and lonely tonight,1
490762,86624,5/14/2011 5:07,42.27167 93.43031,Knowing that 7th Aug is so near  i just feel chills running down my spine! :S,1
490855,86643,5/16/2011 22:14,42.25781 93.4367,Ernest W. Lefever  89; Rejected as a Reagan Nominee,1
490912,86653,5/7/2011 14:08,42.27019 93.22861,One website says I'm walking slowly through life and approaching my goals in the same manner and I have things about myself I need to le,1
491006,86666,5/14/2011 19:58,42.26429 93.26256,Returning to Classrooms  and to Severe Headaches,1
491156,86692,5/15/2011 20:30,42.22449 93.35003,My trig. Professor sip on coke while teaching! :),1
491370,86726,5/12/2011 15:15,42.218 93.41434,Was on the beach today  it was so hot the whole day but the water was very cold. Our neighbour has maken a biq fire  it was danqerous.,1
491415,86730,5/9/2011 18:42,42.21299 93.39117,Summer comes  leaves you with a fever you caught when you were young. Summer goes  makes you feel like love is real and hanging on for m,1
491482,86739,5/10/2011 2:32,42.24159 93.36681,OH MY GOSH! I don't remember a day like this! It's freaking cold. -10 Grad (that's 14 Fahrenheit) and it's just the BEGINNING!!! Help!!!,1
491636,86768,5/10/2011 14:19,42.2012 93.29651,my lown more cough fire lol,1
491706,86783,5/4/2011 18:46,42.22685 93.36561,Ahhhhhhhhhhhhhhhhhhhhh Trey songz the moment I get chills watching him!!! I love him he is so freakin fine dang I need to meet him!,1
491846,86804,5/5/2011 20:33,42.17555 93.46466,#newtwitter gives me a headache,1
491959,86821,5/9/2011 13:45,42.27874 93.23819,Urghh dying of cough here! I apologise in advance to anyone who has to suffer with it this week  im spreading like wild fire!,1
492101,86852,5/4/2011 15:52,42.21918 93.33805,OK beer  I'm tired of my cold...let's do this!!,1
492121,86855,5/15/2011 22:08,42.18351 93.4355,Take me away from here. Take me somewhere where love is like breathing.,1
492126,86857,5/13/2011 22:13,42.25014 93.5042,My 2 year anniversary (tomorrow) is really giving me bad baby fever. I feel like I've paid my dues and waited the socially acceptable ti,1
492237,86880,5/9/2011 19:05,42.23658 93.35842,#dontyoujusthateitwhen you cant breathe in the mosh pit & feel like you're about to die.,1
492300,86891,4/30/2011 10:42,42.23127 93.53895,holding on to anything is like grasping for more breath when there is enough,1
492341,86900,5/3/2011 3:06,42.20533 93.32087,Wooooo my 22nd BDAY is approaching!!! :D,1
492729,86968,5/14/2011 21:16,42.26282 93.55533,I REALLY want the #newtwitter and my sweatshirt back.,1
492793,86972,5/7/2011 10:27,42.26724 93.39397,so today 3 of us caught a cold. the one that didnt is allergic to the entire world and catches everything in his path. guess who?,1
493235,87054,5/9/2011 21:48,42.23717 93.44469,Come in tonight from 7-10pm.  All You Can Bowl for $10.00 per person including shoes!  The beer is cold!,1
493342,87071,5/7/2011 3:00,42.16877 93.20225,Is it better to fast when its REALLY hot  or when its REALLY cold?,1
493674,87140,5/10/2011 19:08,42.17584 93.47664,There's cold  and then there is Matt Kemp.  Wow  what happened to that dude?,1
493795,87159,5/1/2011 21:34,42.21771 93.48383,Good afternoon people. I'm still recovering from a bad cold. And tomorrow at work ... is better than being at home.,1
493928,87180,5/14/2011 21:54,42.2124 93.34404,wtf?! my cat is like coughing really weridly?! what do i do?!!?!,1
494152,87215,5/8/2011 15:18,42.28287 93.55253,OMG! My stomach is aching from laughing soooo hard at the public meeting. Btw the ppl around me and the DIVINE 9 speakers I was crying!,1
494197,87221,5/2/2011 23:01,42.21535 93.35243,Now I can breathe  turn my insides out and smother me  warm and alive I'm all over you,1
494327,87236,4/30/2011 10:45,42.21771 93.34044,Revenge is a dish best served cold.,1
494591,87270,5/1/2011 3:52,42.25014 93.43191,Too much to handle - a debate and australian masterchef final. Watching with bated breath from the other side of globe #ausvotes #master,1
494639,87277,4/30/2011 15:33,42.27167 93.42512,Terrible news. I am ill. I have an awful cold. I'm hardly ever ill  this is a disaster.,1
494698,87286,5/11/2011 10:21,42.23157 93.20744,Okay  this is cruel and unfair- my latte hard candies are giving me headaches!,1
494780,87300,5/16/2011 16:02,42.27314 93.27973,*holding breath* Gonna get really possed if this is what I think is going to HAPPEN!!!!!!!!!!!!!!!!!!!!!!,1
494849,87315,5/8/2011 10:51,42.24248 93.42871,just noticed: i'm freezing. WHY IS IT SO COLD? #welcometocanada,1
494872,87319,5/1/2011 13:18,42.29997 93.51778,My back is really cold though. There's no good way to wear this thing.,1
494882,87326,5/8/2011 3:47,42.18233 93.4367,Beauty is pain  dis headache na DIE!!!!!,1
495101,87354,5/10/2011 20:06,42.23363 93.36201,Applying pressure is the only thing that is making this cough stop :( This is rather uncomfortable,1
495194,87367,5/12/2011 0:57,42.27697 93.29811,It is actually so cold that my head hurts,1
495470,87428,5/10/2011 2:45,42.21329 93.37759,Apparently Arcade Fire's latest is 'arguably better' than Ok Computer. To which I rebuttal by vomiting in your face.,1
495546,87452,5/4/2011 21:49,42.19176 93.37479,the beat of 'tell me' by bobby v is so COLD to me,1
495732,87477,5/13/2011 20:13,42.21211 93.37759,a kiss is a lovely trick designed by nature to stop speech when words become superfluous,1
496187,87547,5/9/2011 12:55,42.25515 93.56252,Out in the desert they wander hungy hlpls n cold,1
496419,87573,5/16/2011 19:51,42.27638 93.25777,I need starbucks and a really cold day.. I really need it! ):,1
496532,87592,5/9/2011 15:01,42.18616 93.55133,So... I've been trying to stay cool and unflustered about all of this... But seriously  Now I feel spurned!...  #NewTwitter,1
496610,87603,5/2/2011 5:23,42.23304 93.34484,#dontyoujusthateitwhen someone is tlkin to u n their breathe is hummin.so you back up n they get closer to you? SMH #hotassbreathe,1
496657,87609,5/10/2011 14:38,42.29172 93.23819,Teaching a child not to step on a caterpillar is as valuable to the child as it is to the caterpillar.  ~Bradley Millar,1
496673,87610,5/16/2011 18:55,42.24454 93.33006,goodevening tweepals.... dis coughing is killing me... anyways...whole day at home today....boring friendship day,1
496754,87620,5/9/2011 14:00,42.19088 93.3712,I`m cold...my feet is like ice.,1
496828,87632,5/3/2011 10:46,42.24307 93.42672,back to 40...... i nid to see doc!!!!! fever is back  sore throat and no voice -.-,1
496862,87641,5/5/2011 8:32,42.21122 93.34644,mmm. nicholas jerry jonas...you are simply breathtaking. &lt;3,1
497064,87673,5/6/2011 14:23,42.2239 93.36641,Simple minds... so young and so much to learn... teaching a padawan what grime is...!,1
497346,87733,5/11/2011 6:51,42.21358 93.34883,Are you broken? Are you bleeding? Is your blood red? Are you breathing?,1
497501,87756,5/10/2011 6:11,42.24041 93.34683,My sister is already getting a light headache :P,1
497536,87759,5/1/2011 15:29,42.22538 93.34324,why is england so cold and boring all of the time?,1
497545,87763,5/4/2011 23:00,42.26076 93.49582,i think i've just got a 2' ball of fluff out of my belly button ho no its 1.5' sad,1
497616,87774,5/9/2011 19:56,42.22626 93.32846,The heat is settin off my headache #hssst,1
497661,87781,5/13/2011 16:02,42.23746 93.33166,{{ATTN}} I jus left my doctors office about my headache... they said I jus need lots and lots of head... fight fire with fire... who's d,1
497815,87806,5/3/2011 17:09,42.23186 93.30889,I want a pet dinosaur...that breathes fire,1
497869,87815,5/12/2011 8:20,42.25781 93.41833,It is fire breathing dragon hot in OKC this morning,1
497980,87829,5/13/2011 19:00,42.20415 93.38278,i wanna breathe that fire again.,1
498191,87866,5/4/2011 17:49,42.21063 93.39037,Bugger! Monday is fast approaching. :( But  had a great Saturday night and #Sherlock is on in half an hour! :),1
498248,87872,5/8/2011 6:02,42.16994 93.40475,Mom scolded me even though I know that it is your love for me,1
498376,87891,5/16/2011 15:44,42.21152 93.20984,The Big Brother house is full of a bunch of loonies! *cough* Rachel  Kristen  Brendan  and Kathy! *cough* #BigBrother12,1
498674,87937,5/11/2011 10:11,42.20356 93.39956,Disaster Prevention  Mitigation Dept: 4 provinces still affected by flood  death toll reaches 257;15 provinces face extended cold spell/,1
498790,87952,5/14/2011 10:06,42.20562 93.32886,Headin' to bed in a few mins....2morrow s gonna b another cold and long day like everyday of my life is....used to the long part by now,1
499090,88013,5/11/2011 19:27,42.2242 93.32487,So proud to call these women my sisters.Their presence is breathtaking,1
499352,88061,5/16/2011 3:32,42.27019 93.27454,My online proff done gave me a headache and made my stomach hurt. Like wtf!?,1
499500,88099,4/30/2011 17:32,42.23953 93.56132,#L2ce More: [IT'S HARD to believe Sanctus Real is approaching a decade in Christian music. This quintet has done a lot of growing up  a.,1
499509,88099,5/3/2011 17:32,42.18999 93.52897,Henri Frdric Amiel~ To know how to suggest is the art of teaching.,1
499524,88101,5/13/2011 22:25,42.19795 93.31768,The sunrise really is impossible to watch without losing my breath to Gods majesty.,1
499546,88106,5/13/2011 7:13,42.28936 93.27933,Off to sleep now. A sudden thought that is disturbing me is making me not to concentrate. And I'm having a crazy headache. Nites pweeepe,1
499583,88111,5/13/2011 23:06,42.23186 93.26296,The devil is alive I feel him breathing...,1
499710,88138,5/3/2011 16:35,42.21211 93.33046,Still suffering from insomnia and a broken vcr. Will most likely be up all night. This is what I call fun.,1
499716,88138,5/6/2011 16:35,42.23835 93.35283,Tylenol PM is better than takin an Ambien.I think doctors should prescribe it for their patients w/ insomnia cuz I was knocked the fudge,1
499896,88167,5/9/2011 6:38,42.2242 93.38518,Just hearing my boss's smokers cough across the room is enough to keep me off the cigs  bleh!,1
500036,88192,5/9/2011 16:03,42.29643 93.47824,to me sayin somethin was 'chills' is just a nice way in sayin that it was boring #myopinon,1
500097,88200,5/4/2011 19:49,42.22007 93.24898,Swine Flu Scare Tests Bloomberg's Political Skill,1
500161,88210,5/11/2011 14:21,42.27049 93.32327,i can spill cold water on customers who piss me off and there's nothing they can do about it. fire me? HAH today's my last day SUCK ON T,1
500472,88307,5/6/2011 17:08,42.23275 93.34723,is hoping baby girl gets over this cold.,1
500538,88320,5/10/2011 22:12,42.17525 93.44469,omg its soo cold...I feel like going to school in my jammies brrr...but that would be a ridiculous fashion disaster lol xD,1
500552,88323,5/3/2011 6:51,42.22567 93.35043,#Toronto Is anybody reaching TOTC tmrw night??,1
500597,88329,5/4/2011 5:35,42.22596 93.24259,-coughs-Back WHERE IS MY DRAGON!,1
500802,88363,5/13/2011 11:08,42.27108 93.36601,The heat is the most nasty thing any human can experience. I prefer the cold for almost the whole year.,1
501381,88465,5/1/2011 20:28,42.27255 93.48543,If love was a fire  then we have lost the spark. Love never felt so cold.,1
501498,88484,5/4/2011 17:05,42.2183 93.35522,I'm stting here with my sweatshirt on with the hood up. It's so coooold!,1
501720,88529,5/3/2011 14:06,42.18764 93.38837,#dontyoujusthateitwhen things gets in the middle of your way from reaching your goal.,1
501824,88542,4/30/2011 7:05,42.24041 93.33965,my skin is 100 degrees yet im gettin chills my throat has all but closed up on me and my skin is irritable to the touch WTF,1
501917,88566,5/8/2011 5:33,42.2982 93.31169,so cold im gonna brush my teeth with warm water,1
501958,88576,5/8/2011 13:45,42.25162 93.42871,OH! :( Please don't let the Baby It's Cold Outside scene be a dream sequence! That'd break my heart! #Glee,1
502183,88632,5/14/2011 21:42,42.27668 93.41513,The fire in my eyes make my heart turn cold,1
502225,88644,5/8/2011 5:12,42.25162 93.44229,Life is not measured by the breaths we take but by the Moments that take our breath away,1
502789,88761,5/8/2011 2:09,42.24159 93.35922,Headache is terrible pain in my chest lol but I'm not gona let it get me down for real gots do sum TLC tonight sum me tym mwah God is gu,1
502816,88768,5/4/2011 21:45,42.2068 93.55413,As an administrator I have a great snapshot of what everyone is teaching in all subject areas for each day.,1
503656,88909,5/15/2011 6:24,42.21447 93.40195,That's it!  I'm officially sick. &gt;=(  Cold's worse  started coughing  and nose is friggin' red.  Pfft...  &gt;=p,1
503660,88909,5/3/2011 6:24,42.21447 93.41194,I have allergies and cramps. Today is gonna be a great day.,1
503977,88959,5/2/2011 1:41,42.17083 93.37679,Love the 10AM preaching today! God is awesomely great.,1
503985,88963,5/14/2011 7:25,42.27697 93.51339,Why Am I Like This   Well Why Is Winter Cold...................ur on fire,1
504126,88984,5/12/2011 7:54,42.21535 93.35522,Wishing it were possible to 'love' a song on Last FM more than once.  Say  47 times in a row.  That's how much I &lt;3 the Cold War Kids,1
504135,88986,5/1/2011 3:33,42.28169 93.41673,Jungle Fever came out in 1991 and there is still self-hate in our communities and hate on white women w/blk men #smh,1
504186,89000,5/2/2011 17:16,42.16582 93.44549,This cut on my head is giving me a headache... Smh..,1
504296,89015,5/5/2011 10:13,42.21329 93.32686,You can tell when church is going to be over! Pastor starts singing while preaching and hold the notes,1
504329,89018,5/2/2011 19:26,42.218 93.39916,Im a lil fatigued idk wat the hell is really goin on with me smh lol,1
504480,89046,5/3/2011 17:14,42.28788 93.31169,I love watching Dexter all warm with my sweatshirt and blanket while it is raining!,1
504645,89071,5/3/2011 15:29,42.22272 93.3684,My god  rachel weisz is breathtaking in this film.,1
504719,89085,4/30/2011 21:43,42.21741 93.48503,Always believe that everyday is your lucky day. Because god give you to breathe this day.,1
505032,89142,5/4/2011 16:34,42.27786 93.27814,My chest is killing me. No bueno. HEARTBURN.,1
505198,89164,5/7/2011 6:54,42.1897 93.40994,I should have stolen my little brother's sweater...or some supplies to light coldstone on fire,1
505245,89169,5/14/2011 3:28,42.28051 93.37639,we PRAYiNG & im mad cus this girl behind me come LATE & all she wanna do is #coughcoughcough; stay home & be a #SickandShutIn dang !!,1
505430,89200,5/6/2011 6:51,42.26931 93.237,#dontyoujusthateitwhen SOMEONE TRIES TO TALK TO YOU AND THEIR BREATH SMELLS LIKE AZZ SMH,1
505536,89216,5/7/2011 10:11,42.21594 93.38638,Breath the air of reality  no matter how hard is it  I won't life in fantasy,1
505558,89218,5/6/2011 21:50,42.26017 93.4351,Ok..so I completely lose my breath while playing #GodofWar3. This game is a true work of art. #ps3,1
505929,89289,5/8/2011 20:54,42.22479 93.33286,My birthday is approaching pretty darn fast!!! Yes!!,1
506181,89345,5/2/2011 13:38,42.25221 93.53616,now my tea is cold :[,1
506223,89351,5/7/2011 0:20,42.18999 93.36321,I think I'm formally sick. I've had a headache for two days and I'm losing my voice.....#twitterbowl at your own risk!,1
506231,89352,5/9/2011 13:47,42.21771 93.235,seems like winter is almost over....yay! was a really cold winter this year!!,1
506351,89370,5/13/2011 23:59,42.2127 93.38318,this headache is major..,1
506539,89400,5/15/2011 1:57,42.23953 93.32806,My Saturday headaches are back. Swell! :(,1
506567,89412,5/12/2011 22:54,42.21122 93.37839,planning this trip is starting to give me a headache! why did i volunteer to be the planner?!,1
506715,89429,5/12/2011 15:31,42.23098 93.24498,I got up for a cold glass of milk & checked my Twitter page & now I am wide awake - need to read awhile & go back to sleep - good night,1
506762,89441,5/12/2011 3:32,42.21506 93.3712,Is it cold outside?,1
506908,89460,5/12/2011 10:11,42.24395 93.51259,The flame of love is now just a cold loneliness.,1
507219,89511,5/10/2011 12:50,42.23835 93.33845,The cold & tiredness is making me feel worse. Wanna curl up in ball whcih = dumb cause it'll be fine. I just HATE inconvenience of stupi,1
507229,89512,5/2/2011 12:51,42.26931 93.54175,#dontyoujusthateitwhen Jim jones tlk I swear he has a stuffy nose n a head cold,1
507286,89521,5/1/2011 5:39,42.21918 93.27654,The dust from d renovation in d offc is not only making me cough but now giving me a headache. All d things flying in d air must b poiso,1
507384,89540,5/16/2011 3:09,42.18587 93.44988,fold-out couch and tortoise breath. is this what home is?,1
507473,89556,5/13/2011 23:09,42.28464 93.48383,hate it when my noise gets cold lol,1
507666,89600,5/6/2011 22:21,42.25221 93.4395,Johannes M. Simmel  84  Writer of Cold-War Novels,1
507763,89618,5/9/2011 2:44,42.22479 93.3712,So is everyone just bleaching their hair blond now? I misse the memo.,1
508188,89693,5/12/2011 9:55,42.2183 93.3688,Sitting in the cold  because I can't start the fire. FML,1
508609,89782,5/13/2011 6:02,42.21063 93.34524,my body is dying from fatigue.,1
508733,89802,5/16/2011 8:51,42.20798 93.3684,Smile  though your heart is aching.. Smile even though its breaking...,1
508754,89809,5/4/2011 9:37,42.16935 93.55533,GAD= going to cris-s to crisis ...symptoms= somatic = muscle tension   fatigue  and metal agitation,1
508820,89824,5/12/2011 11:38,42.20827 93.32407,A stinking cold  hundreds and thousands of emails to work through  AND it is Monday. #waheeey,1
508900,89833,5/10/2011 11:25,42.22921 93.37839,Whenever I see Flushing  NY  such as where the Arthur Ashe Kids Day event is...I think of The Nanny  lol.,1
508963,89856,4/30/2011 5:14,42.22036 93.505,cold water is the worst,1
509009,89862,5/15/2011 20:49,42.24425 93.34843,City fixing fire hydrant  so low pressure. Closed bathroom for fear of patron busting a gut and not being able to flush. #libday5,1
509100,89873,5/12/2011 18:29,42.21712 93.25856,Lil Kim done fluffed up. She went at nicki  young money  and diddy. Bad move.... that's a recipe for disaster,1
509428,89941,5/12/2011 15:19,42.24454 93.27015,A new study has shown that instances of coughing fits go up exponentially as soon as someone starts praying. #ldsconf,1
509440,89943,5/5/2011 0:20,42.19117 93.38917,i have a runny nose  which makes me breath so hard.....my uncle is i kind of getting weird out by my hard breathing LOL,1
509458,89944,5/3/2011 16:10,42.23393 93.44789,faith in Jesus Christ and following his teachings gives us hope #ldsconf,1
509643,89984,5/5/2011 17:35,42.21122 93.38118,my feet are sooooo cold in this house  that I'm now wearing my genuine mongolian slippers,1
509820,90014,5/2/2011 18:32,42.2413 93.33246,My body is aching today!,1
510010,90050,5/6/2011 21:49,42.16375 93.47944,Ok I'm officially SHOOK .... Law abiding citizen is actually scary for a thriller  considerin they're normally not. #BREATH,1
510204,90088,5/3/2011 14:40,42.16582 93.3009,meet me on thame st ill tke u out thogh i'm hardly wrth ur time in the cold u look so feirce but i'm warm enough cuz the tensions lke a,1
510264,90095,5/15/2011 22:24,42.22714 93.19626,Realizing that Breath is the kernel of all practice #struggle #attention #meditation #yoga #martialarts #life #prayer,1
510280,90101,5/14/2011 12:05,42.23068 93.53336,Wisdom is like breathing...everyone needs it and no one can give you theirs.,1
510289,90101,5/12/2011 12:12,42.1782 93.49342,Like seriously my heart is aching; IDK anymore It jus aint da same feel distance. Pills afta pills their jus aint enough my stomach hurt,1
510362,90117,5/15/2011 17:51,42.21889 93.37519,Saindo ouvindo Cemeteries of London-Coldplay!,1
510394,90125,5/16/2011 14:37,42.25604 93.42392,Teaching Crisis Comm'n Mngmt Spring semester. Many thanks to WikiLeaks  TSA  and local pols for providing all the material I need!,1
510654,90174,5/16/2011 12:55,42.22508 93.33405,What I love about Henry B. Eyring is that he is always teaching us how to serve; his talks turn outward in discipleship. #ldsconf,1
511231,90278,5/4/2011 21:40,42.18705 93.42911,my salad addiction is reaching a scary level...,1
511505,90330,5/8/2011 20:45,42.23186 93.34524,The water is so cold ! I'm freezing ! I think Imma run out after this . Lol .,1
511512,90332,5/15/2011 9:28,42.17791 93.22581,Child is born  with a heart of gold; way of the world  makes his heart sooo cold...,1
511568,90340,5/9/2011 5:19,42.24218 93.26895,I hate it when a teacher with stank breath talk in my face!,1
511728,90365,5/3/2011 8:27,42.28936 93.33645,Teaching Sunbeams is the most challenging  and most fun  calling I've ever had. They teach me as much as I teach them. #ldsconf,1
511738,90376,5/6/2011 4:54,42.26724 93.24179,Breathe Like Water and Fire,1
512000,90425,5/7/2011 8:24,42.20592 93.38997,i swear the girl my mom has is like 14 and she be up and like 8am EVERYDAY  caking...stankin' breath & all. lol,1
512069,90433,5/7/2011 6:36,42.21624 93.38278,When I come home cold and tired  It's good to warm my bones beside the fire!,1
512218,90465,5/2/2011 6:36,42.28582 93.49621,Im starting to get bad fatigue.But im going to a fire pyro party next week!,1
512246,90467,5/12/2011 22:45,42.26547 93.38078,smile though your heart is aching,1
512259,90468,5/15/2011 13:34,42.27845 93.28133,I'm getting a headache and my arms feel like they're on fire.,1
512460,90506,4/30/2011 21:31,42.27992 93.3708,Oh why why why is aberdeen so cold?,1
512542,90520,5/1/2011 1:15,42.23511 93.34524,Ugh...headache is back,1
512639,90537,5/6/2011 13:49,42.20592 93.33765,WOOHOOOO...HEADACHE IS GONE....THAT LIL WHITE PILL IS THE SHAT!!!!! *crip walks out the room*,1
513019,90596,5/10/2011 22:06,42.28877 93.22262,T.T i keep repeating word to tell ppl abt the experiment . It is worse cos i having flu.,1
513914,90757,5/11/2011 8:48,42.27874 93.34484,Worst cramps in the world and the only Tylenol I have is PM. ._. Considering taking it anyway and sleeping another 8 hours...,1
514236,90810,5/15/2011 11:43,42.23039 93.38398,In honor of Shark Week  I got a tattoo of a shark on my left boobie. My nipple is his eye and everytime it gets cold out  he means busin,1
514330,90822,5/2/2011 22:36,42.22685 93.33286,Watching Independence Day on E ch. I&#39;d just relaxed drinking ice cold of tea be in bed. My legs are sore too,1
514366,90836,5/13/2011 10:31,42.21211 93.35163,I will not be a member of a party that thinks social justice is a bad idea. Republicons  save your breath #p2 #tcot #dems #gop #progress,1
514579,90876,5/15/2011 21:09,42.24012 93.32846,My boyfriend is now called the situ-asian. Yes  I have yellow fever.,1
514740,90900,5/12/2011 0:24,42.2752 93.26695,Prize in Hand  He Keeps His Eye on Teaching,1
515059,90959,5/1/2011 12:23,42.22184 93.21303,Out of that cold cold place!! But outside is colder!! :(,1
515083,90962,5/11/2011 23:50,42.26606 93.22102,ehhh! I forgot my school jumper  the cold is eating me!! Can i please borrow someones jumper today? I didnt have enough room to pack min,1
515128,90967,5/2/2011 19:53,42.25545 93.44589,Sundance 2010 | Coming Out of the Cold,1
515306,90983,5/9/2011 13:08,42.21122 93.3684,Cold and gray out... But it's still fun snowing! Made my (very) short walk worth it :),1
515446,91016,5/9/2011 16:14,42.2755 93.46945,Great example - shouting/scolding won't repair a situation - make the best of what's happened. #ldsconf,1
515481,91021,5/12/2011 5:57,42.20444 93.39277,Winning is the most important thing in my life  after breathing. Breathing first  winning next. George Steinbrenner (1930-2010),1
515551,91033,5/6/2011 8:39,42.20444 93.39636,Dragon2nya flu is coming. #monyek,1
515595,91039,5/13/2011 16:47,42.18675 93.32686,All this drawing is giving me a headache. And I'm so hungry. Someone should bring me Subway. Stat.,1
515652,91054,5/10/2011 2:42,42.22272 93.33885,This the time when u wish ur significant other lived with u  my daughter is screaming and my stomach is aching badly,1
515894,91103,5/7/2011 11:32,42.27609 93.44629,Why is it so cold in my grandmaws house .!,1
516043,91124,5/7/2011 2:53,42.22655 93.31408,is feeling better. No more aching but I'm being forcefed porridge =3=,1
