,ID,Created_at,Location,text,label
250701,44619,5/3/2011 14:27,42.27137 93.28493,Bye bye summer.falls this month back to being colder than it already is,1
250857,44638,5/9/2011 10:04,42.28641 93.22142,We are cold to others only when we are dull in ourselves  and have neither thoughts nor feelings to impart them. (Hazlitt),1
251177,44700,5/10/2011 0:43,42.19383 93.33246,Jesus christ the repetition on Twitter is mad. Peoole preaching the same thing every couple of days.,1
251182,44702,5/9/2011 18:21,42.19088 93.52218,i can tell school's approaching. the calendar is getting full. :-/,1
251204,44703,5/1/2011 12:32,42.2752 93.31169,Teaching a child not to step on a caterpillar is as valuable to the child as it is to the caterpillar.,1
251330,44716,4/30/2011 11:52,42.18056 93.48503,My characters seem to be suffering from fatigue  but we're still pushing through the end of the novel.,1
251549,44762,5/15/2011 14:59,42.21476 93.40874,I hate it when I lose a tooth because I've been smoking too much methamphetamine. Must remember to get fluoride toothpaste at the store.,1
251568,44768,5/5/2011 10:11,42.25427 93.53616,Disaster Prevention Mitigation Dept: 4 provinces still affected by flood  death toll reaches 257;15 provinces face extended cold spell :,1
251718,44804,5/10/2011 11:51,42.21535 93.24059,Wht is that cold beverage that you get from starbucks,1
251892,44836,5/4/2011 9:22,42.21653 93.36521,It is COLDD! Time to start a fire and relax with her;),1
252068,44856,5/1/2011 15:02,42.24778 93.46426,-fried chickem flu is the number 1 #TT. lol.,1
252329,44907,5/8/2011 20:33,42.2183 93.42113,An Ambassador's Stone-Cold Party Pad,1
252397,44929,5/16/2011 17:57,42.16877 93.3001,Up since 4am coughing. This is fun. At least I can sleep in if I can ever get back to sleep.,1
252493,44947,5/12/2011 18:41,42.27019 93.25817,Out of Work In Finance  They Turn To Teaching,1
252542,44955,5/7/2011 1:41,42.21535 93.368,My daughter is down with fever. I can't even remember the last time she was sick. She is one tough cookie. Hope she always stays that wa,1
252583,44963,5/11/2011 13:23,42.21771 93.39716,95 Celsius... Way to hot in a sauna. Well... now I know. Cold Bitburger is a relief.,1
252798,44992,5/13/2011 2:28,42.2295 93.35962,Wallace Shawn from 'Princess Bride' walked through security with me at DTW. I felt weird approaching so I stared at him instead lol,1
252854,44999,5/14/2011 2:18,42.19058 93.52937,Defensive coaches are really emphasizing tacklig this year. Even Capers is over coaching up the DL and LBs in another fundamental drill.,1
253106,45057,5/10/2011 11:55,42.19766 93.25817,It's like a freaken' hurricane outside! I really hope I don't lose power because my house would get like so cold without the heater o_O,1
253231,45081,5/11/2011 22:08,42.28759 93.42632,So what's people ?? Just toke long  nap and hope my headache goes away. ! Anyway Rocco's behavior is not so good right  now :(,1
253429,45111,5/1/2011 18:42,42.27167 93.54215,#predictingkanyetweets The ramifications of the BP oil spill will be far reaching and unmeasurable for years to come.,1
253581,45136,5/5/2011 23:20,42.22508 93.28972,Only 3% of the earths water can be used by humans and animals yet one American flushes up to 26gallons/day just using the toilet! #doome,1
253589,45136,5/16/2011 1:43,42.25427 93.40755,Headache still  back feels all weird... kind of a sucky Saturday.,1
253663,45146,4/30/2011 23:50,42.19913 93.34564,writing for me is like breathing. I always amaze myself & love the one who created me because i am dented ; flawed but still shine somet,1
253732,45156,5/1/2011 15:53,42.24749 93.27734,wow when negativity hits you  the only way to overcome it is approaching it with optimism. hopefully all this is in God's plans.,1
253855,45173,5/8/2011 5:35,42.21329 93.34004,I took a hot shower at noon and a cold shower at night..I must be out of my mind..why is it upside down..lol..O.o,1
253890,45182,5/14/2011 9:22,42.21447 93.2366,Adidas sweats with Nike flip flops... #PureDisrespect.,1
253909,45185,5/9/2011 22:07,42.2466 93.32806,I've Got Some Mad Headache.. This Is What Lack Off Sleep Does =[,1
253973,45191,5/9/2011 10:32,42.2127 93.39397,almost footy time! chillin with some music and a cold drink,1
254140,45217,5/16/2011 17:48,42.25191 93.41314,Sleep is an elusive quarry sometimes. That's ok  I keep a shotgun under the bed for when I find it. #insomniasnarkisnotasfunny,1
254583,45320,5/7/2011 0:32,42.21918 93.39876,Lolz #masterchef pwned by Santo Sam and Ed #worldcupfever,1
254822,45365,5/14/2011 1:40,42.24454 93.28093,But my nose is burning from blowing it. It hurts to breath -_-,1
254840,45377,5/6/2011 6:15,42.28818 93.42672,Best thing about a cold morning is coming downstairs and the kitchen fire is still on.,1
254851,45377,5/4/2011 7:52,42.2413 93.44429,As Latter-day Saints  we have faith and confidence in our prophets  which is why we follow their teachings. #ldsconf,1
254864,45378,5/10/2011 21:20,42.17348 93.38398,sees regular proof that he sweats more that others in similar condition and wonders why that is.  Also  it is gross.,1
255067,45421,5/15/2011 7:21,42.16523 93.37519,have a stupid #coldsore feel like my lip is getting bigger by the second oww lol,1
255131,45427,5/15/2011 19:58,42.22213 93.20185,Ok is it jzt me or is it cold?,1
255172,45436,5/6/2011 12:54,42.21741 93.35123,And the insomnia continues this is night 3.... ughhh. #fb,1
255284,45461,5/14/2011 21:29,42.25103 93.51619,#dontyoujusthateitwhen someone breath stinks and they act like they dont know . So u offer some gum and they still dont get it .,1
255485,45497,5/9/2011 21:40,42.27019 93.20504,Omo... This breese is cold die!,1
255600,45518,5/11/2011 18:01,42.17702 93.49222,Mane now my headache is worse :| I wish I never came home!,1
255696,45531,5/1/2011 12:08,42.2298 93.5034,Mets need to fire their coaching staff and their management they suck!!!!!!,1
255797,45541,5/3/2011 23:08,42.23864 93.42512,OMG. Today is just. COLD.-.-,1
255866,45559,5/3/2011 14:27,42.21329 93.41314,My chest is aching severely. No idea why,1
255887,45562,5/4/2011 12:38,42.241 93.31488,The body is not appreciating the heavy dose of antibiotics coursing through it.  #heartburnnauseaindegestionupsetstomachdiarrhea,1
255923,45570,4/30/2011 15:54,42.2239 93.34683,Headache  what I gonna eat today?! Huaqiangbei is perfect place for working  but not for eating.,1
255940,45573,5/1/2011 1:09,42.20326 93.39636,Is it wrong for me to want to go to summer bridge and poke at the freshmen? Yes? Ohkay. #immachillshirley,1
256141,45600,5/14/2011 2:08,42.28022 93.41234,I just tucked my ears into my cap  bc I'm THAT cold. Where is summer?!,1
256178,45605,5/3/2011 16:16,42.23039 93.46306,| Enjoyed lunch and conversation with my friend Clarence Presley  now it's back to the dentist (with bad breath) for a little bit of wor,1
256273,45627,5/8/2011 4:59,42.26813 93.37999,The only way to treat the common cold is with contempt.,1
256359,45650,5/7/2011 16:20,42.22154 93.54614,arr this headache is killing me:/,1
256508,45667,5/1/2011 5:06,42.25574 93.34524,There's a chemical spill near where I live  I hope it's not deadly to breathe it...,1
256620,45692,5/5/2011 22:13,42.24484 93.47984,Now one of my new fave places in SoCal; This place is breathtakingly beautiful:),1
257158,45790,5/7/2011 18:38,42.24513 93.44389,Uhh it is August why are girls still walkin around wit sweaters & scarfs? I know its not dat hot but its not dat cold eitha..,1
257237,45803,5/4/2011 22:49,42.23393 93.27055,I'm COLD but my body is HOT   lol,1
257240,45803,5/12/2011 22:49,42.22184 93.36681,RT Let her breathe easy...the worse thing you could do...is try to control her. Be her Man  Not Her Daddy...,1
257279,45809,5/4/2011 20:07,42.23982 93.56132,NATIONAL BRIEFING | WEST; California: Pneumonia  Not Drugs  Killed Actor,1
257341,45815,5/16/2011 1:30,42.23098 93.35043,#this kaone is kinda sorta 'Unwell'!,1
257343,45815,5/1/2011 1:30,42.21034 93.37639,Sheet. This is why i hate flu . :,1
257526,45829,5/13/2011 5:05,42.24218 93.35642,I had energy so I took a shower  and then my energy level died...i think this cold is gonna prove more stubborn than I thought.,1
257678,45862,5/1/2011 20:45,42.20267 93.39596,Jumble Fever,1
257845,45889,5/9/2011 2:18,42.22655 93.34444,she said my mind is summer time and my heart is cold season... mmm,1
258008,45911,5/7/2011 12:49,42.23334 93.34683,Early night is approaching.,1
258067,45929,5/14/2011 10:21,42.22036 93.37479,you know that like winter smelll outside  it smells like fire  and it's cold. i loveeeee it . :D,1
258070,45929,5/10/2011 10:22,42.23717 93.32966,Took a nap in front of the of the fireplace (sidenote: first fire of the season!!!)  but the headache is still kickin'.,1
258154,45946,5/13/2011 17:32,42.2581 93.34644,The greatest enemy to the Christian Conservative  are the teachings of Jesus! #p2 #tcot #dems #topprog #tlot #teaparty,1
258167,45947,5/4/2011 11:28,42.22803 93.33166,The house is quiet. I can hear it breathing.,1
258300,45981,5/13/2011 10:20,42.23216 93.33006,why do we not have flying cars yet!? i blame the end of the cold war.,1
258830,46073,5/3/2011 21:18,42.25545 93.21223,I am so glad my headache is going away. I've had it since yesterday. It made babysitting last night a little tough  but I made it throug,1
258845,46074,5/2/2011 0:28,42.28788 93.53935,Jono serves my little pony vomit as lust? WTF  #masterchef,1
258901,46082,5/1/2011 1:57,42.2295 93.28213,Breathe. Let go. And remind yourself that this very moment is the only one you know you have for sure.,1
259307,46160,5/7/2011 5:51,42.24601 93.33765,No I cant leave.....I'm addicted.....My cough is hurting my throat and chest like CRAZY Help!,1
259319,46162,5/11/2011 11:20,42.2926 93.51139,Rt: somefriend.  Pele is here at #copanyc in Flushing Meadows to announce the re-launch of the New York Cosmos. History happening right.,1
259651,46219,5/11/2011 19:10,42.24277 93.46346,SHANNON MORREU TOMO VOMITO E JARED FLEXIVEL EM HURRICANE,1
259954,46281,5/16/2011 2:07,42.23658 93.51658,my #1 goal for today  above all else......is to stay awake!! #upallnightwithfeverishgirl,1
260203,46321,5/1/2011 17:16,42.21682 93.26855,Is awake  grumpy  has a headache and aliitle sad ... It must be Monday boooo!,1
260223,46327,5/3/2011 14:48,42.22508 93.34124,#dontyoujusthateitwhen ya nipples get hard as rockz when it gets cold...? real shxt,1
260228,46327,5/10/2011 17:12,42.29466 93.54374,Cold as fire baby  hot as ice :),1
260515,46379,5/6/2011 19:47,42.2239 93.27814,Breathing fire catching bullets and kicking asses.,1
260564,46385,5/14/2011 1:58,42.23039 93.33325,Is danielle still breathing ?,1
261176,46511,5/13/2011 22:21,42.2982 93.51858,Just got my flu shot at walgreens From the drive thru.,1
261178,46511,5/3/2011 22:21,42.28316 93.41673,The challenge: can I teach tonight without losing my voice or coughing up a lung (or something equally disgusting)?,1
261194,46515,5/5/2011 18:59,42.23334 93.33445,Christmas has vomited all over my flat in the form of about a million fairylights. My electricity bill is going to be huge and I don't c,1
261510,46575,5/2/2011 3:05,42.26223 93.44948,good morning people! Out with the flu finally but voice is hilarious!,1
261525,46576,5/7/2011 2:28,42.2239 93.51579,Eurgh. This is giving me a headache.,1
261753,46626,4/30/2011 20:41,42.28051 93.38598,I&#39;m cold is time for my bed  hope the day comes to an end quickly,1
261818,46640,5/11/2011 19:12,42.22125 93.33565,Working in the cold cold district.,1
262022,46677,5/13/2011 9:08,42.24366 93.28093,Gillard and Abbott totally just flunked the invention challenge. #debate #masterchef,1
262090,46686,5/16/2011 21:35,42.23599 93.36081,My fingers are about to fall off. Lifting off 52 pieces of glass in the freezing cold. Disaster.,1
262328,46732,4/30/2011 19:25,42.17555 93.40675,Flurry of Data as Rules Near for Commercial Colleges,1
262344,46733,5/13/2011 5:57,42.21034 93.36201,insanity or insomnia ? whatevr it is   its all because of these exams which im cramming for (again) T_____T,1
262762,46799,5/10/2011 12:28,42.28434 93.46945,The treatment seems to be working. Fever is still down. Rash is less prominant. He is eating a gogurt now. Just got his 2nd chest xray.,1
262769,46800,5/2/2011 13:02,42.27461 93.53456,Something must be stealing my bandwidth this morning. Internet is ball-achingly slow.,1
262793,46802,5/12/2011 10:39,42.29702 93.28852,Force is gonna fluctuate soon :S,1
262906,46834,5/3/2011 15:32,42.26724 93.55653,Emerald 1.41 G VVS1 EX VG IGI Non Fluo Non Brown for 38% back.Price per Carat is USD 4 588 All Inclusive.Call 044-42935016/17 for Info.,1
262917,46836,5/1/2011 21:43,42.22066 93.35402,so it's 105 degrees outside and i'm inside in a sweatshirt. Thermostat is set at 76. I have a cold and chills. #Nice...,1
262938,46837,5/5/2011 16:20,42.2867 93.34004,Hello whoever is reading this I want to let you know that everything is going to be okay. So breathe  close your eyes  and smile. &lt;3,1
263405,46904,5/10/2011 21:07,42.23157 93.25058,So cold outside. Glad the fire is lit inside.,1
263620,46946,5/7/2011 19:01,42.18675 93.54215,Ever woke up w/ a headache? Today I did  and it's still not gone. I'm not in the mood for anything today  but my bed. Ugghhh...,1
263621,46946,5/10/2011 19:01,42.20945 93.41793,feeling phlegm in my throat  this is not a good sign. I keep wheezing a bit in my esophagus when I breathe. UGH.,1
263731,46964,5/16/2011 4:53,42.21211 93.28173,I walk outta churches when the choir or preaching is bad. Lord let the spirit be in this place...,1
263757,46968,5/4/2011 21:58,42.16582 93.48503,my arm is aching pretty good today. but on a good note  they gave me vicodin for the pain.,1
263868,46992,4/30/2011 16:11,42.21152 93.3712,News reaching us that On A Mission service 44 is not running at the moment  all buses have been taken off the road.. More details soon,1
263887,46993,5/2/2011 17:26,42.19678 93.39476,Time for bed. Cold cold night.. My bed is so big I get lost in it. Night world :) x,1
263988,47013,5/8/2011 1:23,42.21624 93.32487,Ugh.  Down with the flu. Becoming best buddies with my couch. Reality TV is almost bearable in a marathon.,1
264633,47120,5/4/2011 19:24,42.21476 93.38997,Affluent Indians Sending More Students Abroad,1
264714,47130,5/6/2011 19:41,42.2811 93.47944,Vengeful Fury In Drug War Chills Mexico,1
264760,47134,5/11/2011 19:35,42.17791 93.40834,MIDEAST IN FLUX; An Israeli Cozies Up To Moscow,1
264832,47143,5/2/2011 21:29,42.25958 93.38797,Why is Frost/Nixon not about bleaching Richard Nixon's hairtips?,1
264927,47164,5/9/2011 0:29,42.27402 93.47385,Ugh.  Down with the flu. Becoming best buddies with my couch. Reality TV is almost bearable in a marathon.,1
265171,47209,5/5/2011 17:31,42.23393 93.49262,In Iran  Future Of University Is in Flux,1
265225,47218,5/7/2011 6:54,42.17319 93.39756,In order to reach the people that no one else is reaching  we have to do the things that no one else is doing,1
265585,47268,5/15/2011 17:38,42.2298 93.38598,There have been alot of things I have said in my life  and every day I believe less and less of those things.  God is teaching me to hol,1
265755,47294,5/14/2011 17:51,42.21329 93.35762,Fluency isn't a hard thing but what type of fluency you want is,1
265951,47323,4/30/2011 1:51,42.25486 93.26416,I was boiling water...came upstairs and forgot that I was  and started watching vids. My coffee is BURNING and I added ice cold water to,1
266067,47341,5/11/2011 23:10,42.28906 93.21663,Freezing cold in the #dmv it's like 10 degrees warmer at my house,1
266128,47354,5/1/2011 4:28,42.22773 93.29251,Quite possibly the most sickening feeling on earth is reaching for your toothbrush only to find that its already wet.,1
266168,47362,5/8/2011 21:51,42.27904 93.28972,#dontyoujusthateitwhen People don't cover their mouth while sneezing or coughing. #gross,1
266341,47387,5/10/2011 14:21,42.24366 93.32766,Please shower be my guardian and save me from this flue! Cant hold it anymore. Must have TERMIN CANDY! Must have sode (Im out of it) Ple,1
266364,47388,5/15/2011 1:57,42.2354 93.33805,Grate your thumb off  you mouth-breathing weirdo. #masterchef,1
266798,47454,5/9/2011 8:51,42.20474 93.34564,I can't breath..I'm growing abs. This is a problem.. I must never have a awkward night like last night lol. NEVER!,1
266857,47462,5/2/2011 11:38,42.24277 93.33086,The second half of 'Fancy' is cooold..lol reminds of JT with the cold interludes and what not. But yeah the beat is inspiring yo,1
266961,47477,5/11/2011 18:22,42.20621 93.34723,Alarms turned off  Arcade Fire on. Unfortunately  I'm forever cursed with memory and insomnia.,1
267137,47493,5/14/2011 16:31,42.16375 93.56052,Got up a little late  coughing my lungs out. Sunday is my Monday this week. Here I come  work.,1
267792,47609,5/6/2011 22:14,42.25191 93.39197,well i am goin to sleep cause i am gettin a headache from stayin awake! this is crazy,1
268013,47649,5/7/2011 18:19,42.17171 93.37799,At cold times like these   all i want is just to my arms around you to keep you warm (:,1
268204,47684,5/13/2011 22:14,42.2752 93.49142,Feel guilty for issuing Anna a challenge to eat 6 blazin' wild wings for $100. She got through 5 and is threatening to vomit in my face,1
268252,47690,5/16/2011 1:55,42.2124 93.2314,take it slow when it comes to finding love.. sometimes the hottest love has the coldest endings,1
268416,47711,5/6/2011 22:12,42.22832 93.53735,So my wrestling name is 'Quiet Bear' David Fluty. part of my culture. I found out my dad's side is 67% Souix and some others,1
268424,47711,5/4/2011 22:12,42.23422 93.51019,If it's zero degrees outside today and it's suppose to be twice as cold tomorrow  how cold is it going to be?,1
268426,47711,5/2/2011 22:12,42.25191 93.46386,is looking for something to do this August before he begins teaching high school mathematics...   somewhere.,1
268436,47717,5/8/2011 15:35,42.21122 93.34803,This fan is probably doing nothing for this summer cold.. Ugh.,1
268528,47728,5/13/2011 13:45,42.24808 93.50061,i shouldn't be wearing Jeans to go cycling in the summer  but i know its gonna get reaally cold  which is a depressing thought,1
268540,47729,5/9/2011 20:45,42.27992 93.30929,all my notes typed and printed I'm on fire today and I'm now a member of a teaching union too...,1
268634,47763,5/14/2011 16:06,42.21211 93.20385,try not 2 care I'd lose my mind unning round the same thing time after time only 2 things bound to soothe my soul cold beer & remote con,1
269089,47851,5/12/2011 20:40,42.2982 93.20025,In the library cold&bored&feeling the need to tweet every thought that pops into my head..,1
269187,47875,5/11/2011 13:56,42.24189 93.32886,LETTERS; The Hacker Who Went Into the Cold,1
269211,47881,4/30/2011 23:19,42.26341 93.46466,Through the fire and the flames a sea of dead drives me insane. We march the fight into the cold' #ETF,1
269269,47886,5/16/2011 18:14,42.16965 93.42472,Guy Secret #35: One sign a guy wants to kiss you is if he's popping in breath mints...like every 5 minutes or so.,1
269387,47909,5/12/2011 17:53,42.2068 93.33685,why is it so cold in my apartment?,1
269423,47917,5/8/2011 6:36,42.27697 93.33485,so now lunch is microwavable curry looks like orange vomit with bigs lumps but tastes ok and spring rolls i have yet to try those,1
269683,47960,5/2/2011 6:09,42.27343 93.33086,my mum is so lame. -.- she scold me for being late  like she never late before like this .,1
269743,47976,5/13/2011 21:02,42.21034 93.3716,REACHING AN AUTISTIC TEENAGER,1
269771,47979,5/2/2011 22:01,42.2923 93.51698,Pouring cold water into a hot pan with oil in it is not a good idea.,1
269859,47991,5/10/2011 22:30,42.2755 93.38278,#DontYouJustHateItWhen someone just wakes up  and they yawn w/o  covering their mouth and u smell the morning breath air,1
269865,47991,5/15/2011 16:09,42.21417 93.38598,Faith in Jesus Christ and following his teachings give us hope.,1
269866,47991,5/10/2011 16:09,42.22184 93.33565,Following Christ and His teachings gives us a hope that will firmly anchor our souls. #ldsconf,1
269953,48007,5/5/2011 11:11,42.23245 93.36441,For 'ldsconf'  Twitter is leaps and bounds above Facebook public mentions - Twitter showing approaching 1 500 mentions of '#ldsconf' now,1
270015,48019,5/14/2011 20:01,42.20385 93.52018,Thoughts are brought about by grasping with vision  vision is created from the will and controlled by the genius your breath.,1
270100,48028,5/12/2011 12:07,42.218 93.37479,Well it's not called abusing sleep inducing cough syrup if u still have a sore throat right? Sedilix is noice :),1
270200,48049,5/7/2011 2:47,42.28081 93.56132,Why is this cold not leaving me?!?!,1
270406,48077,5/11/2011 6:37,42.20975 93.34204,That Sagna goal looks a little funny. It is a strike  but it looks more like a fluke.,1
270443,48082,5/4/2011 3:18,42.20768 93.35243,The hardest part of living is just taking breaths to stay,1
270532,48100,5/7/2011 9:54,42.28169 93.41793,Band parades + sore head gives you one massive headache,1
270610,48117,5/4/2011 14:35,42.25574 93.49901,my hot water bottle has went cold already :O aint much bloody good!,1
270708,48133,5/3/2011 12:50,42.25132 93.27654,Finally! Going back home. My feet is aching. And wooo! One of the workers at disney was cuyooote.,1
270969,48174,5/7/2011 14:24,42.22184 93.24059,Oh okay I officially caught a cold. == and wearing a pair of shorts in the night at this kind of place is not a good idea at all.,1
271256,48231,5/13/2011 7:25,42.23098 93.37639,The bus air con is so cold,1
271456,48257,5/12/2011 21:37,42.21565 93.32726,Followers  'Operation Hydration' is in full effect. Drink plenty of water and often. Headache is 1st sign of dehydration. Be safe!,1
271467,48258,5/15/2011 5:19,42.25162 93.48783,Ur The Fire When I'm Cold!,1
271499,48266,5/9/2011 9:56,42.22538 93.36601,I have a magically pony that breathes fire and poops holy grenades which abstain people of their sins,1
271531,48270,5/8/2011 21:29,42.2699 93.45867,Why haven't I been to sleep yet?! I will be in a few minutes from the Tylenol PM. My knee is aching. =(,1
271632,48288,5/15/2011 17:41,42.23127 93.54814,Y is rachel wearing a sweatshirt over that prom dress? Y was she wearing a prom dress to begin with. Y am I watching BB instead of packi,1
271679,48296,5/6/2011 2:53,42.21535 93.3728,Is finally reaching home!! Woo! (;,1
271825,48324,5/7/2011 3:42,42.21506 93.38278,A great country does not begin with a great economy. It needs more than money. It helps if you can breathe the air & drink water #ausvot,1
272023,48350,5/10/2011 18:40,42.20592 93.35682,I'm one stomach flu away from my goal weight!! #dwp,1
272035,48354,5/15/2011 1:57,42.21122 93.32087,my headache is increasing in a increase rate. ==!,1
272128,48369,5/4/2011 8:07,42.22125 93.36201,A kiss is a lovely trick designed by nature to stop speech when words become superfluous. - Ingrid Bergman,1
272173,48375,5/9/2011 4:22,42.20474 93.33885,My feet are cold but I'm too lazy to go and put some socks on. This is how the dinosaurs died out.,1
272198,48377,5/8/2011 14:10,42.25751 93.4351,My mom's grasak cuspajz is second to none.  Good hot or cold  day or...right now.,1
272337,48407,5/14/2011 12:21,42.23275 93.35482,You're ruling the way that I move  not breathe your air. You only can rescue me. This is my prayer...,1
272396,48419,5/14/2011 16:09,42.24189 93.35362,Why is it so hard to bathe before coming out in public? #airportsmellypeoplemakemevomit This guy is RIPE.,1
272580,48452,5/7/2011 13:14,42.218 93.39397,What makes a protein or hormone so powerful is when it is activated with attention or flux of manifestation.,1
272597,48454,5/12/2011 20:47,42.27992 93.32167,#AMemoryYouCantForget the Swine Flu Pandemic. Is it over or just dormant until next winter? &gt;.&gt;,1
272617,48457,5/11/2011 3:52,42.23186 93.28732,Omg my back is killing me. It hurts to breathe  it hurts to move. I just wanna cry right now!,1
272659,48464,4/30/2011 12:45,42.21181 93.21503,My little bro is teaching 4 y/o sis fractions. Aww finally they are getting along LoL,1
272798,48479,5/4/2011 23:50,42.19353 93.21343,it is 5am. ugh. random case of insomnia. least favorite.,1
272807,48480,5/12/2011 21:02,42.27815 93.2358,Thrilled that it's December.  Not for the cold or the snow.  For #reverb10.  Already got my word for today.  Need to blog it tonight.  &,1
272889,48498,5/7/2011 14:39,42.28081 93.54175,THEATER REVIEW | BELLPORT; Musical Fluff With an '80s Vibe,1
272922,48502,5/5/2011 5:49,42.25722 93.40675,J is finally feeling better! Fever is now below 100....YAY!!!,1
272940,48506,5/1/2011 1:32,42.20238 93.32726,Lol my big brother has got a cold and he's lying in bed and I'm throwing old cans of red bull at he's head lool,1
273030,48520,5/4/2011 20:11,42.24159 93.37,Man the bus is sooo cold!,1
273197,48544,5/6/2011 3:33,42.19972 93.51858,so tired  but can't sleep. if my body must stay awake  at least cbs is nice enough to rerun an episode of cold case i've never seen befo,1
273222,48551,5/6/2011 9:50,42.21977 93.28533,Apartment is tidied again! Amazing  two weeks in a row. Could this be a trend? I'm not going to hold my breath.,1
273632,48615,5/16/2011 5:20,42.17761 93.40315,my body is still aching.,1
273733,48633,5/13/2011 11:17,42.21358 93.25018,im wearinq only onee sockk & the other foot is hellaa coldd,1
273883,48660,5/7/2011 3:17,42.18557 93.55573,Poor boy is down with fever. I'm reviewing Pn. Yeap's short 'lecture' and advice. Maybe I should take her advice.,1
273921,48681,5/7/2011 22:12,42.23452 93.3708,There's something oddly wonderful about sleeping most of the day... that is  when you don't sleep yourself into a headache.,1
274151,48707,5/16/2011 1:22,42.24336 93.36081,My nose is red :( its cold,1
274175,48710,5/9/2011 6:21,42.27815 93.48423,Because this is what happens every time I travel...Bop complained last night and this AM of ear pain. No fever. Yet.,1
274322,48738,5/15/2011 21:38,42.29496 93.49182,Where are the men if we need 'em.. ?!! My bed is cold..,1
