,ID,Created_at,Location,text,label
755102,133149,5/13/2011 5:14,42.1897 93.34124,Note to self: when hubby is bed hogging in his sleep  apply ice cold feet to his warm legs. Works like a charm!!,1
755500,133224,4/30/2011 23:31,42.20562 93.39676,Anyway I have a headache & my stomach hurts =,1
755603,133239,5/15/2011 21:57,42.20857 93.36321,Impeaching a federal judge today.,1
755661,133247,5/13/2011 2:15,42.20415 93.34444,Ohh there's a fire ! Lol well now I'm cold :(,1
755798,133273,4/30/2011 17:47,42.24513 93.33845,GREEN TEA FEVER IS BACKKKKKKKK~,1
755928,133295,5/13/2011 4:30,42.21329 93.34763,Also it's freezing cold today. My fingers are frigid from using my computer. D:,1
755956,133307,5/15/2011 17:51,42.21682 93.20105,how can we forget who we have become? i'll give it all up  please wake up. every breathe you take  is a lie. &hearts;,1
755974,133309,5/7/2011 10:20,42.27668 93.50101,Nice to see moments like that to show us that yes  the apostles are human. :) They cough and lose their voice too. :) #ldsconf,1
755984,133313,5/8/2011 12:46,42.23481 93.34803,#dontyoujusthateitwhen FOR LADIES: you go talk to a dude and his breath smell like unwiped asshole....#ugh *Wayne voice*,1
756282,133372,5/13/2011 14:29,42.21506 93.24139,My headache is back again  I think it's part of this virus. I watched 'Little Miss Sunshine' and am now going to bed  it's nearly 1am.,1
756327,133377,5/14/2011 5:55,42.27226 93.43191,You know that heartburn that feels like your entire throat and chest is on FIRE?! I had that almost all day today until it finally went,1
756483,133407,4/30/2011 22:29,42.2469 93.33725,The only thing I HAVE to do in this life is die. Everything else is a choice with consequences - including breathing,1
756643,133435,5/8/2011 6:03,42.24248 93.23061,Oh my gosh  this headache is beating me down. I better not have this all day. I am afraid it might be a migraine in the making.,1
756923,133490,5/14/2011 17:47,42.23658 93.35362,#dontyoujusthateitwhen men act like little babies becuz they a cough&act like they're about to die? When I'm sick he tells me suck it up,1
757106,133525,5/14/2011 18:12,42.16316 93.54534,For Attorney General  New Congress Means New Headaches,1
757109,133525,5/8/2011 12:29,42.18469 93.46905,NATIONAL BRIEFING | WEST; Cold and Snow Take Their Toll,1
757121,133536,4/30/2011 2:44,42.21211 93.35203,it is incredibly cold...,1
757359,133589,5/15/2011 6:10,42.18439 93.38039,Amazing how out of breathe dave is from walkin in the garden!,1
757608,133628,5/13/2011 6:47,42.2127 93.34564,I am extra hot right now... Is something wrong with me? Hope I'm not catching a cold!!! Ughhhhh,1
757620,133629,5/5/2011 22:03,42.18764 93.53096,DAMMM. just found out Coldplay bit Craftwork!!! Jay-why you didn't tell me? lol (big bro  phone is back on tomorrow call me after my shi,1
757720,133652,5/12/2011 23:10,42.23511 93.35283,Just took a shower and suddenly the headache is gone! Yeaaaah! :D,1
757968,133685,5/13/2011 17:22,42.22744 93.34803,Is everybody cold-hearted ?,1
758093,133707,5/1/2011 16:09,42.19088 93.32766,The fact that Spire Christian Comics published a few legitimate Archie titles is no coincidence. The preaching's just a hair more overt.,1
758326,133745,4/30/2011 15:12,42.28847 93.49142,Creeping Out | Fever Ray's Music Videos,1
758377,133760,5/2/2011 1:56,42.22685 93.5078,Music is what I breathe  what I love to do. It keeps me alive.,1
758451,133767,5/1/2011 6:25,42.20385 93.39237,Stupid insomnia..  this is bad  gotta be up in 3 1/2 hours :(,1
758535,133776,5/5/2011 14:13,42.21388 93.37559,Please remind me to remind my job  that if I get walking n this cold  I'm killin SOMEBODY..#justsayin,1
758645,133793,5/8/2011 13:47,42.25987 93.54974,A full exciting day ahead but my brain is full of thoughts keeping me from sleeping...#teaminsomnia I shouldn't have had a nap ;-D &lt;3,1
758892,133842,5/14/2011 12:09,42.26017 93.42392,I'm gonna keep preaching the word of Freddie Gibbs.  Dude is a beast on the Mic.  Peep the song 'Close Your Eyes'  straight FIRE.,1
758912,133843,5/12/2011 22:26,42.24631 93.33725,Teaching Psa 50 this morning. A strong message from a dangerous God against meritorious favor and hypocrisy. True sacrifice is thankfuln,1
758926,133844,5/8/2011 11:10,42.21447 93.35283,The hope makes me believe I'll see you again soon.Your bright makes me smile though my heart is aching&you make sure we have nothing to,1
759098,133882,5/5/2011 10:50,42.26931 93.233,Heltah Skeltah is ill. Roccness monsthaz voice is the coldest... Bring back the 90's please...,1
759190,133899,5/14/2011 16:11,42.27638 93.54494,#dontyoujusthateitwhen you can't breathe?,1
759212,133900,5/3/2011 18:39,42.21889 93.37,Hmm  the air is very breathtaking . :),1
759275,133907,5/13/2011 22:33,42.2814 93.38877,Fell down  my whole body is aching now. :(,1
759287,133907,5/8/2011 22:37,42.29938 93.5082,ok  here is how hot it has been: it's 4:30 in the morning here in the panhandle  and the cold tap water is lukewarm... good grief!,1
759307,133913,5/11/2011 20:39,42.2413 93.34883,A teacher's job is to teach and scold whoever misbehave cause eventually they will affect the rest. So why the eff can't you just scold,1
759314,133913,5/6/2011 20:39,42.22862 93.56411,Because these are my last words  and this is my last breath  Id give you everything  but I have nothing left.,1
759372,133926,5/6/2011 14:24,42.23835 93.35123,How To Cure Bad Breath In Less Than 72 Hours & Have Strong Healthy Teeth & A Sparkling White Smile.,1
759391,133927,5/9/2011 4:06,42.23127 93.33685,Oh my God this headache is killin me !!!,1
759497,133949,5/1/2011 0:31,42.26429 93.32726,Life is not measured by the breaths we take  but by the moments that take our breath.,1
759521,133950,5/1/2011 0:51,42.21682 93.36161,If iPhone4 had a app to get rid of cramps id go buy it now,1
759614,133964,5/14/2011 5:48,42.27402 93.3029,Whatever it was tht the devil designed to smother me GOD is now giving me the room to breathe again :) #HALLELUJAH,1
759928,134023,5/7/2011 22:01,42.27078 93.38198,RECIPE; Cold Tomato-Cilantro Soup,1
759998,134032,5/15/2011 21:58,42.20651 93.3736,die for me  you can't save it. my hand  eyes  mind and breath; what is left behind in the end are the rotten memories that have been bur,1
760088,134041,5/14/2011 5:12,42.23422 93.35442,this fever is killing me,1
760609,134123,5/2/2011 5:46,42.22567 93.32407,This poor Walrus was caught in an oil spill and is covered in oil. He is cold and depressed and needs someone to take care of him.,1
760652,134136,5/11/2011 8:33,42.17643 93.55053,Fine  clear morning though somewhat cold.,1
760744,134164,5/10/2011 21:00,42.19117 93.31967,I can't describe how much Coldplay means to me. if you think I like MCR+30STM a lot.. you'd be scared by what Coldplay is[my heart].,1
760965,134212,5/5/2011 21:15,42.20709 93.43151,even worse today. flu is creeping up  I can feel it. no amount of paracetemol is helping :(,1
760989,134221,5/6/2011 11:41,42.1723 93.37519,Becuz ur promo video left me absolutely cold when I should have wanted to give u 'it's alright' cuddles. Maybe what he needs is good wri,1
761099,134252,5/11/2011 4:42,42.18822 93.46626,Y is it so cold in this church  it might be hot outside but dang don't freeze us in here,1
761200,134272,5/13/2011 19:27,42.22803 93.5082,North VA went from the coldest winter to the hottest summer  and we had an earthquake.... only a matter of time before Jesus walks again,1
761446,134313,5/14/2011 16:18,42.19884 93.4375,My hands are so cold they're red  and I can barely type!,1
761515,134326,5/4/2011 19:44,42.27963 93.56052,From Altar Wine to Beer Pong  Flu Fears Crimp Life's Rituals,1
761565,134336,5/6/2011 12:49,42.19913 93.42792,Don't fry your cold turkey  you may put your fire out. #TurkeyFireFail,1
761763,134371,5/8/2011 20:15,42.22862 93.32806,woooowwwww headache. bcz of this i-dosing thing. omggg i feel like my brain is trying to get away from my head it hurtssssss,1
761928,134386,5/3/2011 5:46,42.26164 93.47305,Its so annoying that my oral is on a PE day *Curses under breath*,1
761951,134392,5/12/2011 22:32,42.27167 93.26815,As hot as fire. As cold as ice.,1
762076,134412,5/12/2011 22:01,42.29348 93.49861,And I AM going to quit cigs soon. The time is approaching more and more...,1
762191,134427,5/16/2011 9:03,42.18528 93.32726,Ok so idk who Ivan is  but that last tweet should have said that I know how to play sure fire winners on flute mow,1
762325,134446,5/2/2011 8:13,42.20651 93.35762,What is this? It is so cold!,1
762327,134450,5/7/2011 19:48,42.18085 93.46107,*Breathe in  breathe out* I'm in need of serious relaxation therapy after super frustrating (and unsatisfactory) phone call to SARS,1
762495,134475,5/8/2011 21:24,42.21918 93.40076,SO YOU SEE QUEEN LIZZY IS A FIRE BREATHING NAZI &gt;&gt;JEW EATING REPTILIAN WHO DRINKS WARM CUPS OF IRISH BLOOD EVERY DAY FOR BREAKFAST,1
762684,134500,5/14/2011 4:50,42.1667 93.56292,Angelo is absent today. Makes Monday so much more difficult. So does this stupid cold. WHO GETS A COLD IN THE SUMMER???,1
762860,134528,5/1/2011 10:07,42.2068 93.34883,Sometimes life really sucks. This is one if those times. Breath. Breath.,1
762907,134534,5/6/2011 13:35,42.21859 93.39397,and my headache is gettin worse. =/,1
763245,134589,5/1/2011 2:17,42.22361 93.21024,Revenge is a dish best served cold,1
763561,134650,5/4/2011 12:51,42.25014 93.46506,why does is have to be rainy and freezing cold? its currently 8 degrees celsius at my house!,1
763871,134706,5/1/2011 17:52,42.2068 93.38877,#dontyoujusthateitwhen a female tries to convince u she isn't the one nite type but still gives it up! #saveyourbreath #teamyoustillgoin,1
763910,134713,5/12/2011 3:12,42.18675 93.40595,Its so cold in this house i think my hand just might turn purple.. :/,1
764513,134827,5/13/2011 3:35,42.27904 93.54295,the coldness has arrived..........oh dear :(,1
764632,134856,4/30/2011 22:00,42.28022 93.24259,My goal for this month is to loose weight as much as possible. Less carbs  less sleep  more exercise and more fluid intake. :),1
764715,134872,5/14/2011 1:46,42.21447 93.38837,Do yall know what the best headache medicine is????,1
765016,134926,5/11/2011 6:49,42.28287 93.51339,Smile  though ur heart is aching  even though it's breaking ... Smile & maybe tomorrow You'll find that life is still worthwhile ~Smile-,1
765019,134926,5/6/2011 6:49,42.16493 93.39636,Good morning! Man do I have one hell of a headache! I am such a light weight somehow shot pong is not a good idea! Especially when u mis,1
765206,134961,5/2/2011 14:13,42.17908 93.21223,#GhettoCrayonColors Ghetto weave Green... coughNickiMinajcough.,1
765264,134967,5/16/2011 10:38,42.26076 93.5094,This office is so cold  my fingernails are turning blue.,1
765298,134988,5/7/2011 16:17,42.20709 93.35043,Horace Mann~ A teacher who is attempting to teach without inspiring the pupil with a desire to learn is hammering on a cold iron.,1
765348,134996,5/2/2011 16:59,42.22154 93.33046,Insomnia is a gross feeder. It will nourish itself on any kind of thinking  including thinking about not thinking.,1
765427,135007,5/3/2011 20:21,42.22243 93.39436,Watching Hartley kick that fg against the vikings still sends chills down my spine. Seeing the dome go crazy is priceless,1
765786,135063,4/30/2011 22:12,42.23304 93.34803,I'm watching Blade and it makes me hungry. Is there any relation with my insomnia? #JustThinking,1
765861,135072,5/1/2011 17:05,42.22184 93.503,The cutest little dog is outside  I have no clue what kind  but I think I'm having puppy fever. I could get 1 soon... Maybe.,1
765910,135091,5/8/2011 17:40,42.17319 93.29092,Spring Fever | Print Lives,1
766101,135130,5/12/2011 22:42,42.27638 93.40515,some joker is teaching me how to apply different fonts on facebook...and make pictures and stuff...just learnt how to make 'JAWS',1
766215,135157,5/10/2011 15:30,42.2295 93.33126,Sunday morning  i feel that 'Bomb H' and 'headache' is the same.,1
766259,135163,5/5/2011 21:32,42.2525 93.44789,What woman wouldn't like it.......especially if it is teaching a man how to treat a woman......   :),1
766266,135163,5/9/2011 21:32,42.19206 93.36281,My cramps keep getting worse  my head is spinning. Fml,1
766267,135163,5/9/2011 21:32,42.26017 93.24618,We live in a world where strippers make more money than teachers...what is that teaching?,1
766362,135183,5/1/2011 18:46,42.1838 93.52617,So stuffed up that i Can't breathe through my nose. . . This entire night is gonna suck.  Allergies suck.,1
766549,135209,5/9/2011 9:33,42.21859 93.39436,I sound like a goose  I can't breathe through my nose  and my face feels like it's on fire. let's just say; I'm tired of bieng ill.,1
766666,135229,5/11/2011 21:51,42.17112 93.37439,Visiting the doctor office tomorrow  this headache is driving me crazy.,1
766817,135244,5/9/2011 5:24,42.2124 93.48982,Coldfloorcoldfloorcoldfloor. Floor. Is cold.,1
767318,135323,5/2/2011 22:30,42.23098 93.55693,Yesterday was cold  I like. Today is hot  I don't like,1
767612,135381,5/15/2011 15:52,42.22066 93.3684,Apple pie a la coldstone. Best creation there. MMmmmmmMm,1
767812,135408,5/12/2011 18:31,42.26282 93.41194,Out on the ocean the whole day  gorgeous day. Swimming in the salt water is cleansing for the soul. Now  a lovely ice-cold beer.,1
767815,135409,5/5/2011 16:39,42.218 93.38877,i've lived on this house my whole life and i still forget which tap is cold and which is hot.,1
767822,135409,5/12/2011 16:39,42.2295 93.37919,I feel funny today..... The air outside is bad. So high humidity.... Headache.....,1
767858,135417,5/11/2011 2:07,42.24336 93.32287,My headache is finally gone. It took a whole day literaly! Now I can finally do things today : P,1
768016,135441,5/6/2011 18:28,42.24041 93.52657,When I was little my mother told me I could breath under water and my ass almost drowned because of her.,1
768032,135443,5/16/2011 12:38,42.25574 93.27654,4.8% alcohol only. I will NOT get drunk. But hello  people is a loser in drinking. Headache already. :(,1
768141,135467,5/12/2011 1:57,42.20768 93.3728,is fevering.. :(,1
768212,135482,4/30/2011 22:14,42.2413 93.45508,teaching at Baltimore Crisis Response? A. May. Zing. Another great day with Giti Jabaily teachin' and funnin' and whatnot.,1
768302,135496,5/10/2011 21:29,42.23245 93.50061,Good lord it is cold as hell in this computer lab,1
768474,135526,5/3/2011 20:46,42.25722 93.31728,#dontyoujusthateitwhen you open the fridge and ther is no milk cold?,1
768555,135546,5/11/2011 18:17,42.25545 93.38877,NATIONAL BRIEFING | SCIENCE; Swine Flu Shots Catching On at Colleges,1
768813,135596,5/9/2011 21:49,42.27933 93.43191,is COLD. &gt;.&lt;,1
768898,135609,4/30/2011 10:56,42.16847 93.55133,tomorrow its back to thinking before I act. gosh  this #coaching has got my mind so organized.....is this #creativity at its best?,1
769409,135705,5/12/2011 23:32,42.23393 93.5038,Four New Christians Sundays  all enrolled in 8 Day Coaching!  Heaven is happy!,1
769589,135738,5/12/2011 13:11,42.27904 93.28093,I'm tired of the cold silence... I think i'll just give him a piece of my mind...,1
769594,135738,5/3/2011 13:11,42.18233 93.3033,You breathed life into me. I owe my life to you...,1
769649,135743,5/4/2011 5:31,42.20651 93.36081,My daughter is still sick...  I wish I could take the fever  aches and pain away from her.  :'(,1
769684,135748,5/10/2011 3:08,42.25722 93.24818,Cluster of salt  have washed my face/ Cold crystals woven in smoke/ Cover of gold  a casket of ashes/Dark rings  dark rings/ combs my ey,1
769769,135771,5/9/2011 2:25,42.27963 93.26615,This headache is too odee.,1
770371,135862,5/15/2011 15:02,42.20886 93.3712,My house is cold *turns on heater* *smiles* I should just stay in b,1
770375,135864,5/10/2011 22:18,42.28759 93.25896,i hope shark week will cure my cold... er whatever is wrong with me. i need some ice cream and dr. jones  asap.,1
770412,135868,5/8/2011 22:49,42.20533 93.37519,This cough is getting on my nerves.....,1
770459,135879,4/30/2011 20:56,42.22921 93.32766,KEY | SPRING 2009; Key | Spring 2009 | A Cold season in theHamptons,1
770549,135896,5/6/2011 22:36,42.20798 93.36041,In most countries where it should supposedly be cold  It still feels like July  sunny ..close to day of judgment?,1
770759,135927,5/5/2011 2:32,42.2755 93.34923,NowPlaying Jay-z - American Dreamin ...this song gives me chills...d sample is smthing Else,1
770795,135936,5/13/2011 6:55,42.24071 93.44389,Life is not measured by the number of breaths we take  but by the moments that take our breath away.,1
770951,135963,5/3/2011 21:58,42.1723 93.32527,doesnt like how cold it is ..,1
771056,135989,4/30/2011 22:48,42.19766 93.35522,Mac is so freaking cold,1
771064,135989,5/1/2011 22:49,42.19442 93.37479,A Justin Beiber concert is coming to my neck of the woods this Thursday. I'll put my Hazmat suit on that day to avoid the 'fever'.,1
771095,135992,5/9/2011 23:56,42.22832 93.47984,Thank goodness that clinic is over - Bleurgh! Wore a headband to work today  thought it'd be nice but it's just giving me a headache :(,1
771289,136020,5/9/2011 18:30,42.27933 93.23061,I know this is gonna be something. Let's keep it that way until the day Syracuse dies and I stop breathing.,1
771441,136050,5/7/2011 21:33,42.29024 93.53496,I think Light up by Drake is one of the best hooks I ever heard in my life it really give me chills wen I hear it,1
771442,136050,5/14/2011 21:33,42.24631 93.32886,Is wine Good for getting rid of a headache. .tried everything else. ..,1
771451,136051,5/9/2011 22:33,42.24454 93.32766,fire drills in the freezing cold are not fun!!!!!!! xx,1
771508,136056,5/16/2011 21:30,42.23628 93.32287,#dontyoujusthateitwhen ppl wit stank breath b tyrna tell u secrets,1
771668,136089,5/5/2011 2:50,42.17614 93.21024,It is time to question whether a bipedal  breathing body with binocular vision and a 1400cc brain is an...,1
771794,136119,5/16/2011 3:31,42.22862 93.38039,Just noticed I am warm enough to take off my sweatshirt. Thermostat says it is 72. I &lt;3 you  fireplace!,1
771803,136119,5/16/2011 7:09,42.20886 93.39756,Have to go outside in the snow and walk my dog. I don't want to. Okay  mind over matter  it isn't cold.,1
771877,136132,5/1/2011 5:51,42.23511 93.33046,Stop breathing  imagine none of this is real. I just dance the way i feel.,1
772002,136144,5/2/2011 18:22,42.24071 93.33805,#Dontyoujusthateitwhen your talking to a fine chick and she's got baaad breath?,1
772814,136292,5/9/2011 16:53,42.20179 93.26775,I am SO cold! I need to bring my Snuggie to work,1
772839,136295,5/5/2011 10:50,42.28228 93.33325,My daughter is runnin a really high fever and I can't sleep while I'm worried. I feel like just staring at her sleepin for the night.,1
773003,136322,5/4/2011 21:40,42.21093 93.372,Kyan is being his silly self. Love it! Now let us go home! #cabinfever,1
773085,136338,5/6/2011 14:53,42.23687 93.35123,i am totally regretting not seeing my cardiologist last Thursday. Feeling restless and breathless- my heart is on overdrive.,1
773102,136339,5/9/2011 14:44,42.19737 93.45108,Hai am i gonna flunk my test or what? All tht's left to do is to pray hard...I know  it's just a test.,1
773292,136369,5/2/2011 10:01,42.20768 93.25856,Til Kingdom Come & Ring On Fire (Cover) - Coldplay #NowPlaying,1
773394,136382,5/14/2011 18:41,42.24159 93.36121,Huuuuhhhaaaahhh..take a deep breath..just believe that everything is gonna be okey...,1
773421,136387,5/1/2011 0:44,42.23422 93.35283,Happy Saturday FBers!!  Come in and enjoy a cupcake and a nice ICE COLD glass of milk!!,1
773790,136453,5/7/2011 20:52,42.28022 93.24419,in the cold  you look so fierce but i'm warming up  because the tension's like a fire,1
773826,136456,5/15/2011 22:10,42.21918 93.48623,My BF has the flu.  I can feel myself trying to come down with it.  NOOOO!!!  LEAVE GERMIES  NOW!,1
774020,136497,5/7/2011 21:59,42.24189 93.33965,Wait a minute... ethnic fatigue is about to set in,1
774067,136500,5/10/2011 15:10,42.23245 93.34683,I am cold...&i have my feets cold like the ice.,1
774165,136519,5/15/2011 15:25,42.21506 93.35762,From aching all over to burning on fire. Too much Deep Heat :(,1
774434,136570,4/30/2011 20:58,42.28228 93.46786,argh. Monday morning is fast approaching :(,1
774526,136589,5/4/2011 3:54,42.2012 93.25497,Aw its getting cold brrr,1
774587,136598,5/3/2011 22:52,42.21506 93.31049,#dontyoujusthateitwhen people sit next to the air then say they cold then sit yo ass somewhere else cause it's NOT goin off !,1
774685,136611,5/12/2011 12:44,42.23186 93.33166,A kiss is a lovely trick designed by nature to stop words when speech becomes superfluous.,1
775063,136686,5/5/2011 21:29,42.20326 93.43111,Smile  though your heart is aching (8),1
775205,136708,5/4/2011 23:43,42.22449 93.33605,This headache is no joke.. Wtf,1
775239,136717,4/30/2011 9:04,42.21948 93.25138,Dear southern california  are you having an identity crisis? It's not supposed to be this cold ever. Please sort this out soon. Love  me,1
775518,136773,5/7/2011 15:13,42.22243 93.20065,Nevermind  Sidney is actually getting a headache so we are gonna head home.,1
776005,136860,4/30/2011 21:55,42.25398 93.25337,is cold in my room someone need to turn the heat on!!!,1
776110,136870,5/13/2011 0:07,42.20651 93.35323,Man  being sick sure blows. I'm like what is this  the common cold or UNIVERSAL STUDIOS SINGAPORE?!?,1
776294,136911,5/4/2011 22:15,42.24719 93.3029,Ugh  I Feel Horrible My Nose Is Clogged Got A Headache And I'm Tired,1
776318,136913,5/7/2011 9:16,42.27904 93.23021,Aircon is my remedy when I'm having insomnia. Hope it works now.,1
776893,137015,5/1/2011 22:14,42.17908 93.55613,#dontyoujusthateitwhen You use your flip flop in the public restroom to flush the toilet  and it falls off your foot and into the bowl.,1
776960,137024,5/16/2011 4:40,42.28405 93.37599,even though the popcorn is cold  and the soda isn't what I wanted.,1
777391,137097,5/12/2011 13:30,42.17997 93.41034,If a salesman cold-calls you  rejecting him will fuel his fire and may hurt u in the end. He may have something u are interested in  u k,1
777421,137101,5/3/2011 5:30,42.27461 93.46426,Just woke up... Fell asleep in my bed with no covers or pillow... Woke up shaking it's so cold in my room,1
777500,137113,5/2/2011 18:31,42.2183 93.35203,this headache is killing me + +,1
777620,137144,5/15/2011 16:09,42.22243 93.5038,Not quite winning the battle against a developing headache.,1
777623,137144,5/6/2011 16:09,42.27461 93.33286,Woke up drenched in sweat and with heartburn.,1
777806,137175,5/8/2011 1:56,42.24071 93.22821,I swear my headache is getting worse not better. ): i  cant even fall asleep.....,1
777925,137190,5/3/2011 18:14,42.2295 93.26775,& Suddenly my headache comes back. i should be more specific with words. people tend to take them the wrong way. its all love tho.,1
778139,137228,5/12/2011 12:21,42.29643 93.39357,Fear is a trigger. I wish love was a trigger. I wish it was what made me tremble and took my breath and made me dizzy.,1
778294,137261,5/2/2011 3:40,42.29879 93.34364,NE1fm 102.5 is playing : Violet Hill by Coldplay #nowplaying,1
778315,137269,5/7/2011 9:41,42.26459 93.40355,it is soo cold outside!,1
778435,137293,5/12/2011 15:19,42.21034 93.38198,Even nog de Fluwelengrot in en deze (korte) vakantie is weer voorbij. Op naar de volgende.,1
778455,137297,5/5/2011 12:28,42.26312 93.24419,Love is in the air .. Take a deep breath :),1
779138,137405,5/6/2011 17:30,42.22803 93.33046,Gus is out cold & snoring theessmans,1
779508,137477,5/13/2011 16:15,42.23746 93.35402,#dontyoujusthateitwhen peoples breath smells like an asshole,1
779556,137483,5/2/2011 20:36,42.17053 93.32567,Is flued up n ready 2 die,1
779649,137500,5/5/2011 20:11,42.24071 93.35402,Kind is voor de derde keer speenloos in bed gestopt. Na drie kwartier geouwehoer is het nu stil boven...#zouhetzouhet #coldturkey,1
779733,137508,4/30/2011 13:10,42.20297 93.3724,today is going to be such a long day. and I have the worst headache ever,1
779888,137532,5/11/2011 5:28,42.23304 93.21822,I'm claiming a GREAT wk & A.Haynesworth is not going 2 give me or my Redskins a $100mil headache again this wk. #Perseverence #Hardwork,1
779962,137541,5/10/2011 4:50,42.21211 93.37439,$4500-2004 Ford Crown Vic-This is one of the nicest cars ive owned Cd player cold air runs and drives perfect. Only 120k miles,1
780152,137585,5/5/2011 16:13,42.21918 93.3712,Yangs is making it difficult to breathe.,1
780362,137635,5/11/2011 0:53,42.22361 93.35043,And just like that I hate my vision plan.  $72 yearly but I have no use for prism headache inducing glasses.  #welcometothefuture,1
780368,137635,5/13/2011 5:03,42.23422 93.35163,Nearing the end of my cold tests. My scientists and engineers have done a brilliant job testing me over the past few months.,1
780959,137723,5/14/2011 21:44,42.23923 93.35642,My heart still has a beat but love is now a feat. As common as a cold day in RS.,1
780962,137723,5/12/2011 21:44,42.17083 93.45947,Is it enough to love? Is it enough to breathe? Somebody rip my heart out and leave it here to bleed.,1
780996,137731,5/8/2011 4:46,42.24425 93.28892,this cold is killing man.,1
781048,137745,5/12/2011 23:38,42.24277 93.33485,The temp. of my room makes me feel like a primative caveman. I want to bring my metronome in here so I can see how cold it is.,1
781543,137827,5/4/2011 23:46,42.22095 93.33565,The rain is over. Sunny and cold day on Porto Alegre. Great day today!,1
781634,137849,5/12/2011 23:13,42.21299 93.35123,it is oh so cold in here. ima go put ion a sweater.,1
781700,137867,5/11/2011 4:02,42.21653 93.34803,Another week is approaching fast... Time goes by so fast.,1
781825,137896,5/14/2011 13:11,42.20061 93.44948,He's cough fire. That's funny haha,1
781918,137910,5/6/2011 4:58,42.27373 93.28053,Yeah antibiotics! Sinuses are clear  headache and sore throat gone after just two doses. Science is wonderful.,1
781969,137920,5/9/2011 12:51,42.2413 93.33765,Oh shoot. This boondocks is going after Swine flu. I take high offense to this lol,1
